0,1,2,3,4,5
globenewswire,hagens berman sobol shapiro llp,hagens berman encourages hawaiian electric industries (he) equity and bond investors to contact the firm,"san francisco, oct 07, 2023 (globe newswire) -- hagens berman urges hawaiian electric industries, inc (nyse: he) equity and bond investors who suffered substantial losses to submit your losses now",2023-10-07T18:08:00Z,"san francisco, oct 07, 2023 (globe newswire) -- hagens berman urges hawaiian electric industries, inc (nyse: he) equity and bond investors who suffered substantial losses to submit your losses now… [+3644 chars]"
marketscreenercom,prnewswire,"the law offices of vincent wong remind hawaiian electric investors of a lead plaintiff deadline of october 23, 2023","(marketscreenercom) new york, oct 9, 2023 /prnewswire/ -- attention hawaiian electric industries, inc shareholders: the law offices of vincent wong announce that a class action lawsuit has commenced on behalf of investors who purchased between february …",2023-10-09T09:46:09Z,"new york, oct 9, 2023 /prnewswire/ -- attention hawaiian electric industries, inc (""hawaiian electric"") (nyse: he) shareholders: the law offices of vincent wong announce that a class action lawsui… [+1864 chars]"
marketscreenercom,prnewswire,"the law offices of vincent wong remind hawaiian electric investors of a lead plaintiff deadline of october 23, 2023","(marketscreenercom) new york, oct 2, 2023 /prnewswire/ -- attention hawaiian electric industries, inc shareholders: the law offices of vincent wong announce that a class action lawsuit has commenced on behalf of investors who purchased between february …",2023-10-02T09:46:15Z,"new york, oct 2, 2023 /prnewswire/ -- attention hawaiian electric industries, inc (""hawaiian electric"") (nyse: he) shareholders: the law offices of vincent wong announce that a class action lawsui… [+1864 chars]"
marketscreenercom,prnewswire,"the law offices of vincent wong remind hawaiian electric investors of a lead plaintiff deadline of october 23, 2023","(marketscreenercom) new york, sept 18, 2023 /prnewswire/ -- attention hawaiian electric industries, inc shareholders: the law offices of vincent wong announce that a class action lawsuit has commenced on behalf of investors who purchased between februar…",2023-09-18T09:46:19Z,"new york, sept 18, 2023 /prnewswire/ -- attention hawaiian electric industries, inc (""hawaiian electric"") (nyse: he) shareholders: the law offices of vincent wong announce that a class action laws… [+1866 chars]"
globenewswire,the law offices of vincent wong,"shareholder alert: the law offices of vincent wong remind hawaiian electric investors of a lead plaintiff deadline of october 23, 2023","new york, sept 19, 2023 (globe newswire) -- attention hawaiian electric industries, inc (""hawaiian electric"") (nyse: he) shareholders: the law",2023-09-19T17:04:00Z,"new york, sept 19, 2023 (globe newswire) -- attention hawaiian electric industries, inc (""hawaiian electric"") (nyse: he) shareholders: the law offices of vincent wong announce that a class action … [+1614 chars]"
globenewswire,the law offices of vincent wong,"shareholder alert: the law offices of vincent wong remind hawaiian electric investors of a lead plaintiff deadline of october 23, 2023","new york, sept 28, 2023 (globe newswire) -- attention hawaiian electric industries, inc (""hawaiian electric"") (nyse: he) shareholders: the law",2023-09-28T16:41:00Z,"new york, sept 28, 2023 (globe newswire) -- attention hawaiian electric industries, inc (""hawaiian electric"") (nyse: he) shareholders: the law offices of vincent wong announce that a class action … [+1614 chars]"
marketscreenercom,,"the law offices of vincent wong remind hawaiian electric investors of a lead plaintiff deadline of october 23, 2023","(marketscreenercom) new york, oct 16, 2023 /prnewswire/ -- attention hawaiian electric industries, inc shareholders: the law offices of vincent wong announce that a class action lawsuit has commenced on behalf of investors who purchased between february…",2023-10-16T09:46:12Z,"new york, oct 16, 2023 /prnewswire/ -- attention hawaiian electric industries, inc (""hawaiian electric"") (nyse: he) shareholders: the law offices of vincent wong announce that a class action lawsu… [+1865 chars]"
ndtv news,,how much time does a hacker take to crack passwords? paytm ceo answers,paytm founder and ceo vijay shekhar sharma posted about the importance of passwords and how long it takes a hacker to crack them,2023-10-15T04:22:11Z,new delhi: paytm founder and ceo vijay shekhar sharma posted about the importance of passwords and how long it takes a hacker to crack them mr sharma said that it is the length of the password th… [+2271 chars]
grist,the center for public integrity,"a warming planet is creating a booming, and dangerous, disaster-restoration industry","fueled by immigrant labor, the loosely regulated industry exposes workers to lethal toxins that are making them sick long after the cleanup",2023-09-30T13:00:00Z,"by janelle retka, samantha mccabe, jiahui huang and maría inés zamudio, columbia journalism investigations and the center for public integrity this article was produced in partnership with columbia … [+29336 chars]"
trendhuntercom,,global edge ai platforms - omdena is an edge ai platform that connects experts for collaboration (trendhuntercom),"(trendhuntercom) omdena is a global platform that connects ai engineers, data scientists, and domain experts to collaborate on real-world problems using edge ai omdena has successfully completed over 40 projects in",2023-09-20T11:53:02Z,"omdena is a global platform that connects ai engineers, data scientists, and domain experts to collaborate on real-world problems using edge ai omdena has successfully completed over 40 projects in … [+938 chars]"
the conversation africa,"mojtaba sadegh, associate professor of civil engineering, boise state university, john abatzoglou, professor of engineering, university of california, merced","wildfire risk is soaring for low-income, elderly and other vulnerable populations in california, washington and oregon","alarmingly, about half the people exposed to wildfires in washington and oregon were those least able to afford to protect their homes, evacuate safely and recover",2023-09-20T18:00:02Z,"many of the people caught in the wildfire that swept through paradise, calif, in 2018 were older adults justin sullivan/getty images as wildfires burn across the western us, the people in harms… [+5847 chars]"
marketscreenercom,prnewswire,"pomerantz law firm reminds shareholders with losses on their investment in hawaiian electric industries, inc of class action lawsuit and upcoming deadline - he","(marketscreenercom) new york, sept 21, 2023 /prnewswire/ -- pomerantz llp announces that a class action lawsuit has been filed against hawaiian electric industries, inc and certain officers the class action, filed in the united states district court for…",2023-09-21T17:34:04Z,"new york, sept 21, 2023 /prnewswire/ -- pomerantz llp announces that a class action lawsuit has been filed against hawaiian electric industries, inc (""hawaiian electric"" or the ""company"") (nyse: he… [+5683 chars]"
globenewswire,pomerantz llp,"shareholder alert: pomerantz law firm reminds shareholders with losses on their investment in hawaiian electric industries, inc of class action lawsuit and upcoming deadline – he","new york, oct 03, 2023 (globe newswire) -- pomerantz llp announces that a class action lawsuit has been filed against hawaiian electric industries, inc (“hawaiian electric” or the “company”) (nyse: he) and certain officers the class action, filed in the …",2023-10-03T15:07:00Z,"new york, oct 03, 2023 (globe newswire) -- pomerantz llp announces that a class action lawsuit has been filed against hawaiian electric industries, inc (hawaiian electric or the company) (nyse: he)… [+5384 chars]"
globenewswire,pomerantz llp,"shareholder alert: pomerantz law firm reminds shareholders with losses on their investment in hawaiian electric industries, inc of class action lawsuit and upcoming deadline – he","new york, oct 11, 2023 (globe newswire) -- pomerantz llp announces that a class action lawsuit has been filed against hawaiian electric industries, inc (“hawaiian electric” or the “company”) (nyse: he) and certain officers the class action, filed in the un…",2023-10-11T15:22:00Z,"new york, oct 11, 2023 (globe newswire) -- pomerantz llp announces that a class action lawsuit has been filed against hawaiian electric industries, inc (hawaiian electric or the company) (nyse: he)… [+5376 chars]"
marketscreenercom,,hawaiian electric ongoing investor deadline alert: securities litigation partner james (josh) wilson encourages investors who suffered losses in hawaiian electric to contact him directly to discuss their options,"(marketscreenercom) if you purchased or acquired securities investing in hawaiian electric stock or options between february 28, 2019 and august 16, 2023 and would like to discuss your legal rights, call faruqi & faruqi partner josh wilson directly at 877-…",2023-10-11T15:01:08Z,"if you purchased or acquired securities investing in hawaiian electric stock or options between february 28, 2019 and august 16, 2023and would like to discuss your legal rights, call faruqi &amp; far… [+5449 chars]"
globenewswire,pomerantz llp,"shareholder alert: pomerantz law firm reminds shareholders with losses on their investment in hawaiian electric industries, inc of class action lawsuit and upcoming deadline – he","new york, sept 17, 2023 (globe newswire) -- pomerantz llp announces that a class action lawsuit has been filed against hawaiian electric industries, inc (“hawaiian electric” or the “company”) (nyse: he) and certain officers the class action, filed in the u…",2023-09-17T20:48:00Z,"new york, sept 17, 2023 (globe newswire) -- pomerantz llp announces that a class action lawsuit has been filed against hawaiian electric industries, inc (hawaiian electric or the company) (nyse: he… [+5384 chars]"
marketscreenercom,prnewswire,"hawaiian electric investor deadline approaching: securities litigation partner james (josh) wilson encourages investors who suffered losses exceeding $100,000 in hawaiian electric to contact him directly to discuss their options","(marketscreenercom) new york, sept 23, 2023 /prnewswire/ --faruqi & faruqi, llp, a leading national securities law firm, is investigating potential claims against hawaiian electric industries, inc and reminds investors of the october 23, 2023 deadline to…",2023-09-23T15:01:03Z,"new york, sept 23, 2023 /prnewswire/ --faruqi &amp; faruqi, llp, a leading national securities law firm, is investigating potential claims against hawaiian electric industries, inc (""hawaiian elect… [+5468 chars]"
marketscreenercom,,"pomerantz law firm reminds shareholders with losses on their investment in hawaiian electric industries, inc of class action lawsuit and upcoming deadline - he","(marketscreenercom) new york, oct 9, 2023 /prnewswire/ -- pomerantz llp announces that a class action lawsuit has been filed against hawaiian electric industries, inc and certain officers the class action, filed in the united states district court for…",2023-10-09T17:36:03Z,"new york, oct 9, 2023 /prnewswire/ -- pomerantz llp announces that a class action lawsuit has been filed against hawaiian electric industries, inc (""hawaiian electric"" or the ""company"") (nyse: he) … [+5695 chars]"
marketscreenercom,prnewswire,hawaiian electric securities litigation partner james (josh) wilson encourages investors who suffered losses in hawaiian electric to contact him directly to discuss their options,"(marketscreenercom) if you purchased or acquired securities investing in hawaiian electric stock or options between february 28, 2019 and august 16, 2023 and would like to discuss your legal rights, call faruqi & faruqi partner josh wilson directly at 877-…",2023-10-06T15:01:05Z,"if you purchased or acquired securities investing in hawaiian electric stock or options between february 28, 2019 and august 16, 2023and would like to discuss your legal rights, call faruqi &amp; far… [+5431 chars]"
marketscreenercom,prnewswire,"pomerantz law firm reminds shareholders with losses on their investment in hawaiian electric industries, inc of class action lawsuit and upcoming deadline - he","(marketscreenercom) new york, sept 29, 2023 /prnewswire/ -- pomerantz llp announces that a class action lawsuit has been filed against hawaiian electric industries, inc and certain officers the class action, filed in the united states district court for…",2023-09-29T17:29:04Z,"new york, sept 29, 2023 /prnewswire/ -- pomerantz llp announces that a class action lawsuit has been filed against hawaiian electric industries, inc (""hawaiian electric"" or the ""company"") (nyse: he… [+5683 chars]"
globenewswire,pomerantz llp,"shareholder alert: pomerantz law firm reminds shareholders with losses on their investment in hawaiian electric industries, inc of class action lawsuit and upcoming deadline – he","new york, sept 25, 2023 (globe newswire) -- pomerantz llp announces that a class action lawsuit has been filed against hawaiian electric industries, inc (“hawaiian electric” or the “company”) (nyse: he) and certain officers the class action, filed in the u…",2023-09-25T20:55:00Z,"new york, sept 25, 2023 (globe newswire) -- pomerantz llp announces that a class action lawsuit has been filed against hawaiian electric industries, inc (hawaiian electric or the company) (nyse: he… [+5377 chars]"
marketscreenercom,business wire,"planet gains business across canadian provincial governments, enabling informed disaster response","(marketscreenercom) planet labs pbc , a leading provider of daily data and insights about earth, today announced that it has expanded contracts with existing customers across the canadian provincial governments, including british columbia, the northwest ter…",2023-10-04T13:01:01Z,"planet labs pbc (nyse: pl), a leading provider of daily data and insights about earth, today announced that it has expanded contracts with existing customers across the canadian provincial government… [+3412 chars]"
globenewswire,bragar eagel & squire,"bragar eagel & squire, pc reminds investors that class action lawsuits have been filed against comerica, and hawaiian electric and encourages investors to contact the firm","new york, oct 02, 2023 (globe newswire) -- bragar eagel & squire, pc, a nationally recognized shareholder rights law firm, reminds investors that class actions have been commenced on behalf of stockholders of comerica incorporated (nyse: cma), and hawaiian…",2023-10-03T01:00:00Z,"new york, oct 02, 2023 (globe newswire) -- bragar eagel &amp; squire, pc, a nationally recognized shareholder rights law firm, reminds investors that class actions have been commenced on behalf of… [+3238 chars]"
marketscreenercom,prnewswire,"hawaiian electric claimsfiler reminds investors with losses in excess of $100,000 of lead plaintiff deadline in class action lawsuit against hawaiian electric industries, inc - he","(marketscreenercom) new orleans, sept 22, 2023 /prnewswire/ -- claimsfiler, a free shareholder information service, reminds investors that they have until october 23, 2023 to file lead plaintiff applications in a securities class action lawsuit against ha…",2023-09-23T02:51:06Z,"new orleans, sept 22, 2023 /prnewswire/ -- claimsfiler, a free shareholder information service, reminds investors that they have untiloctober 23, 2023 to file lead plaintiff applications in a secu… [+2343 chars]"
marketscreenercom,prnewswire,"he investors have opportunity to lead hawaiian electric industries, inc securities fraud lawsuit","(marketscreenercom) bensalem, pa, sept 22, 2023 /prnewswire/ -- law offices of howard g smith announces that investors with substantial losses have opportunity to lead the securities fraud class action lawsuit against hawaiian electric industries, inc …",2023-09-22T19:41:04Z,"bensalem, pa, sept 22, 2023 /prnewswire/ -- law offices of howard g smith announces that investors with substantial losses have opportunity to lead the securities fraud class action lawsuit agains… [+2225 chars]"
globenewswire,"levi & korsinsky, llp","shareholder alert: levi & korsinsky notifies hawaiian electric industries, inc (he) investors of a class action lawsuit and upcoming deadline","new york, sept 21, 2023 (globe newswire) -- levi & korsinsky, llp notifies investors in hawaiian electric industries, inc (""hawaiian electric"" or the ""company"") (nyse: he) of a class action securities lawsuit",2023-09-21T16:42:00Z,"new york, sept 21, 2023 (globe newswire) -- levi &amp; korsinsky, llp notifies investors in hawaiian electric industries, inc (""hawaiian electric"" or the ""company"") (nyse: he) of a class action sec… [+2266 chars]"
marketscreenercom,prnewswire,"the gross law firm notifies shareholders of hawaiian electric industries, inc of a class action lawsuit and a lead plaintiff deadline of october 23, 2023 - (nyse: he)","(marketscreenercom) new york, sept 19, 2023 /prnewswire/ -- the gross law firm issues the following notice to shareholders of hawaiian electric industries, inc shareholders who purchased shares of he during the class period listed are encouraged to con…",2023-09-19T09:46:20Z,"new york, sept 19, 2023 /prnewswire/ -- the gross law firm issues the following notice to shareholders of hawaiian electric industries, inc shareholders who purchased shares of he during the clas… [+2668 chars]"
globenewswire,"skymedia, llc","hawaiian electric shareholder alert: claimsfiler reminds investors with losses in excess of $100,000 of lead plaintiff deadline in class action lawsuit against hawaiian electric industries, inc - he","new orleans, sept 26, 2023 (globe newswire) -- claimsfiler, a free shareholder information service, reminds investors that they have until october 23, 2023 to file lead plaintiff applications in a securities class action lawsuit against hawaiian electric i…",2023-09-27T02:30:00Z,"new orleans, sept 26, 2023 (globe newswire) -- claimsfiler, a free shareholder information service, reminds investors that they have until october 23, 2023 to file lead plaintiff applications in a… [+2043 chars]"
marketscreenercom,prnewswire,"levi & korsinsky notifies hawaiian electric industries, inc(he) investors of a class action lawsuit and upcoming deadline","(marketscreenercom) new york, sept 28, 2023 /prnewswire/ -- levi & korsinsky, llp notifies investors in hawaiian electric industries, inc of a class action securities lawsuit class definition: the lawsuit seeks to recover losses on behal…",2023-09-28T09:46:24Z,"new york, sept 28, 2023 /prnewswire/ -- levi &amp; korsinsky, llp notifies investors in hawaiian electric industries, inc (""hawaiian electric"" or the ""company"") (nyse: he) of a class action securit… [+2539 chars]"
marketscreenercom,prnewswire,"levi & korsinsky notifies hawaiian electric industries, inc(he) investors of a class action lawsuit and upcoming deadline","(marketscreenercom) new york, oct 5, 2023 /prnewswire/ -- levi & korsinsky, llp notifies investors in hawaiian electric industries, inc of a class action securities lawsuit class definition: the lawsuit seeks to recover losses on behalf …",2023-10-05T09:46:12Z,"new york, oct 5, 2023 /prnewswire/ -- levi &amp; korsinsky, llp notifies investors in hawaiian electric industries, inc (""hawaiian electric"" or the ""company"") (nyse: he) of a class action securitie… [+2537 chars]"
marketscreenercom,prnewswire,"he investors have opportunity to lead hawaiian electric industries, inc securities fraud lawsuit","(marketscreenercom) los angeles, sept 27, 2023 /prnewswire/ -- the law offices of frank r cruz announces that investors with substantial losses have opportunity to lead the securities fraud class action lawsuit against hawaiian electric industries, inc …",2023-09-27T20:14:04Z,"los angeles, sept 27, 2023 /prnewswire/ -- the law offices of frank r cruz announces that investors with substantial losses have opportunity to lead the securities fraud class action lawsuit agains… [+2039 chars]"
marketscreenercom,prnewswire,"he investors have opportunity to lead hawaiian electric industries, inc securities fraud lawsuit","(marketscreenercom) los angeles, oct 3, 2023 /prnewswire/ -- glancy prongay & murray llp announces that investors with substantial losses have opportunity to lead the securities fraud class action lawsuit against hawaiian electric industries, inc …",2023-10-03T15:01:06Z,"los angeles, oct 3, 2023 /prnewswire/ -- glancy prongay &amp; murray llp (""gpm"") announces that investors with substantial losses have opportunity to lead the securities fraud class action lawsuit a… [+2332 chars]"
marketscreenercom,,"the gross law firm notifies shareholders of hawaiian electric industries, inc of a class action lawsuit and a lead plaintiff deadline of october 23, 2023 - (nyse: he)","(marketscreenercom) new york, oct 10, 2023 /prnewswire/ -- the gross law firm issues the following notice to shareholders of hawaiian electric industries, inc shareholders who purchased shares of he during the class period listed are encouraged to cont…",2023-10-10T09:46:12Z,"new york, oct 10, 2023 /prnewswire/ -- the gross law firm issues the following notice to shareholders of hawaiian electric industries, inc shareholders who purchased shares of he during the class… [+2665 chars]"
globenewswire,"skymedia, llc","hawaiian electric shareholder alert: claimsfiler reminds investors with losses in excess of $100,000 of lead plaintiff deadline in class action lawsuit against hawaiian electric industries, inc - he","new orleans, oct 10, 2023 (globe newswire) -- claimsfiler, a free shareholder information service, reminds investors that they have until october 23, 2023 to file lead plaintiff applications in a securities class action lawsuit against hawaiian electric in…",2023-10-11T01:51:00Z,"new orleans, oct 10, 2023 (globe newswire) -- claimsfiler, a free shareholder information service, reminds investors that they have until october 23, 2023 to file lead plaintiff applications in a … [+2042 chars]"
marketscreenercom,prnewswire,"he investors have opportunity to lead hawaiian electric industries, inc securities fraud lawsuit","(marketscreenercom) los angeles, sept 19, 2023 /prnewswire/ -- glancy prongay & murray llp announces that investors with substantial losses have opportunity to lead the securities fraud class action lawsuit against hawaiian electric industries, inc …",2023-09-19T20:05:04Z,"los angeles, sept 19, 2023 /prnewswire/ -- glancy prongay &amp; murray llp (""gpm"") announces that investors with substantial losses have opportunity to lead the securities fraud class action lawsuit… [+2476 chars]"
globenewswire,"kahn swick & foti, llc","hawaiian electric shareholder alert by former louisiana attorney general: kahn swick & foti, llc reminds investors with losses in excess of $100,000 of lead plaintiff deadline in class action lawsuit against hawaiian electric industries, inc - he","new orleans, sept 19, 2023 (globe newswire) -- kahn swick & foti, llc (“ksf”) and ksf partner, former attorney general of louisiana, charles c foti, jr, remind investors that they have until october 23, 2023 to file lead plaintiff applications in a secur…",2023-09-20T02:38:00Z,"new orleans, sept 19, 2023 (globe newswire) -- kahn swick &amp; foti, llc (ksf) and ksf partner, former attorney general of louisiana, charles c foti, jr, remind investors that they have until oct… [+2451 chars]"
globenewswire,the gross law firm,"shareholder alert: the gross law firm notifies shareholders of hawaiian electric industries, inc of a class action lawsuit and a lead plaintiff deadline of october 23, 2023 – (nyse: he)","new york, sept 22, 2023 (globe newswire) -- the gross law firm issues the following notice to shareholders of hawaiian electric industries, inc ",2023-09-22T16:41:00Z,"new york, sept 22, 2023 (globe newswire) -- the gross law firm issues the following notice to shareholders of hawaiian electric industries, inc shareholders who purchased shares of he during the c… [+2384 chars]"
globenewswire,the gross law firm,"shareholder alert: the gross law firm notifies shareholders of hawaiian electric industries, inc of a class action lawsuit and a lead plaintiff deadline of october 23, 2023 – (nyse: he)","new york, oct 11, 2023 (globe newswire) -- the gross law firm issues the following notice to shareholders of hawaiian electric industries, inc ",2023-10-11T17:01:00Z,"new york, oct 11, 2023 (globe newswire) -- the gross law firm issues the following notice to shareholders of hawaiian electric industries, inc shareholders who purchased shares of he during the cl… [+2381 chars]"
globenewswire,"lowey dannenberg, pc","lowey dannenberg notifies hawaiian electric industries, inc (“hawaiian electric” or the “company”) (nyse: he) investors of securities class action lawsuit and encourages investors with more than $300,000 in losses to contact the firm","new york, sept 26, 2023 (globe newswire) -- lowey dannenberg pc, a preeminent law firm in obtaining redress for consumers and investors, announces the filing of a class action lawsuit against hawaiian electric industries, inc (“hawaiian electric” or the “…",2023-09-26T15:16:00Z,"new york, sept 26, 2023 (globe newswire) -- lowey dannenberg pc, a preeminent law firm in obtaining redress for consumers and investors, announces the filing of a class action lawsuit against hawa… [+2074 chars]"
